Text,Label
"Hey there! Day's good, just taking it one step at a time.",spam
"Good morning! Plans are ordinary, work and maybe a workout.",spam
"Wassup? Nothing much, just chilling and watching some TV.",spam
"Hi! It's been a while, life's busy but manageable.",spam
"Morning! Everything's fine, just the usual daily routine.",spam
"Hello! Not too much happening, just enjoying a quiet day.",spam
"Hey, stranger! Life's good, taking each day as it comes.",spam
"Hi there! Work, eat, sleep – the usual cycle continues.",spam
"Morning! Week's been alright, dealing with the usual challenges.",spam
"Hey! Life's just cruising along, nothing too exciting lately.",spam
"Hi! Juggling work and life, the usual balancing act.",spam
"Wassup? Just relaxing, no big plans for the day.",spam
"Hey there! Long time no talk, how's life treating you?",spam
"Good morning! Routine stuff, but looking forward to the weekend.",spam
"Hello! Same old, same old – work, eat, sleep, repeat.",spam
"Hey, stranger! Life's a rollercoaster, but hanging in there.",spam
"Hi! Week's been hectic, but that's the usual drill.",spam
"Morning! Nothing extraordinary, just the daily grind as always.",spam
"Hey there! Life's been good, enjoying the small moments.",spam
"Hi! Another day, another dollar – you know how it is.",spam
"Wassup? Just the usual, trying to find some relaxation time.",spam
"Hello! Work's busy, but managing to find some balance.",spam
"Hey! Life's treating me well, no major complaints.",spam
Hi there! Weekend plans? Probably just some rest and relaxation.,spam
"Morning! Taking it easy, no major plans on the horizon.",spam
"Hey there! Long time no see, how's everything on your end?",spam
"Good morning! Everyday hustle, but enjoying the journey.",spam
"Hello! Same old routine, but finding joy in small moments.",spam
"Hi! Life's a marathon, just pacing myself through the race.",spam
"Hey! Weekend vibes are calling, hoping for some relaxation.",spam
"Morning! Busy with work, but making time for the important things.",spam
"Wassup? Chilling at home, catching up on some reading.",spam
"Hi there! Life's good, enjoying the simple pleasures every day.",spam
"Hey there! Long time, no catch up – what's new with you?",spam
"Good morning! Day's good, looking forward to the weekend ahead.",spam
"Hello! Routine tasks, but finding joy in the little things.",spam
"Hi! Life's an adventure, navigating through its twists and turns.",spam
Morning! Weekend plans? Maybe a hike and some quiet time.,spam
"Hey there! Life's a journey, embracing both ups and downs.",spam
"Hi! Just another day, finding happiness in the ordinary.",spam
"Wassup? Weekend on the horizon, hoping for some relaxation.",spam
"Hello! Life's good, taking each moment as it comes.",spam
Hey! Long time no chat – how's life treating you lately?,spam
Morning! Weekend plans include some downtime and self-care.,spam
"Hi there! Life's a puzzle, putting the pieces together day by day.",spam
"Hey there! Work's demanding, but finding moments of joy.",spam
"Hello! Weekend's near, looking forward to a bit of leisure.",spam
"Hi! Life's a journey, navigating through its twists and turns.",spam
"Wassup? Chilling at home, catching up on some reading.",spam
"Morning! Day's good, looking forward to the weekend ahead.",spam
"Hey there! Routine tasks, but finding joy in the little things.",spam
"Hello! Life's an adventure, navigating through its twists and turns.",spam
Hi! Weekend plans? Maybe a hike and some quiet time.,spam
"Wassup? Life's a journey, embracing both ups and downs.",spam
"Morning! Just another day, finding happiness in the ordinary.",spam
"Hey! Weekend on the horizon, hoping for some relaxation.",spam
"Hi there! Life's good, taking each moment as it comes.",spam
Hey! Long time no chat – how's life treating you lately?,spam
Morning! Weekend plans include some downtime and self-care.,spam
"Hi there! Life's a puzzle, putting the pieces together day by day.",spam
"Hey there! Work's demanding, but finding moments of joy.",spam
"Hello! Weekend's near, looking forward to a bit of leisure.",spam
"Hi! Life's a journey, navigating through its twists and turns.",spam
"Wassup? Chilling at home, catching up on some reading.",spam
"Morning! Day's good, looking forward to the weekend ahead.",spam
"Hey there! Routine tasks, but finding joy in the little things.",spam
"Hello! Life's an adventure, navigating through its twists and turns.",spam
Hi! Weekend plans? Maybe a hike and some quiet time.,spam
"Wassup? Life's a journey, embracing both ups and downs.",spam
"Morning! Just another day, finding happiness in the ordinary.",spam
"Hey! Weekend on the horizon, hoping for some relaxation.",spam
"Hi there! Life's good, taking each moment as it comes.",spam
Hey! Long time no chat – how's life treating you lately?,spam
Morning! Weekend plans include some downtime and self-care.,spam
"Hi there! Life's a puzzle, putting the pieces together day by day.",spam
"Hey there! Work's demanding, but finding moments of joy.",spam
"Hello! Weekend's near, looking forward to a bit of leisure.",spam
"Hi! Life's a journey, navigating through its twists and turns.",spam
"Wassup? Chilling at home, catching up on some reading.",spam
"Morning! Day's good, looking forward to the weekend ahead.",spam
"Hey there! Routine tasks, but finding joy in the little things.",spam
"Hello! Life's an adventure, navigating through its twists and turns.",spam
Hi! Weekend plans? Maybe a hike and some quiet time.,spam
"Wassup? Life's a journey, embracing both ups and downs.",spam
"Morning! Just another day, finding happiness in the ordinary.",spam
"Hey! Weekend on the horizon, hoping for some relaxation.",spam
"Hi there! Life's good, taking each moment as it comes.",spam
Hey! Long time no chat – how's life treating you lately?,spam
Morning! Weekend plans include some downtime and self-care.,spam
"Hi there! Life's a puzzle, putting the pieces together day by day.",spam
"Hey there! Work's demanding, but finding moments of joy.",spam
"Hello! Weekend's near, looking forward to a bit of leisure.",spam
"Hi! Life's a journey, navigating through its twists and turns.",spam
"Wassup? Chilling at home, catching up on some reading.",spam
"Morning! Day's good, looking forward to the weekend ahead.",spam
"Hey there! Routine tasks, but finding joy in the little things.",spam
"Hello! Life's an adventure, navigating through its twists and turns.",spam
Hi! Weekend plans? Maybe a hike and some quiet time.,spam
"Wassup? Life's a journey, embracing both ups and downs.",spam
Hey! How's your day going?,spam
Hi there! Any fun plans?,spam
Hello! What's new with you?,spam
Wassup? How are you?,spam
Hi! Long time no talk!,spam
Morning! Doing well?,spam
Hey there! How's life?,spam
Hi! Plans for today?,spam
Hello! Missed you!,spam
I appreciate the transparency in your communication about service disruptions. Thank you for the updates.,not spam
I encountered a problem with the payment gateway during checkout. Can you help me troubleshoot?,not spam
I accidentally deleted an important file from my account. Is there a way to recover it?,not spam
I'm interested in your company's environmental initiatives. Can you share more about your sustainability efforts?,not spam
"The order I placed is marked as delivered, but I haven't received it. Can you assist in tracking it down?",not spam
Your customer support chat feature is convenient. Do you have plans to expand chat support to weekends?,not spam
"I received an email about an upcoming webinar. How can I register, and what topics will be covered?",not spam
I have a suggestion for a new feature in your app. Where can I submit feature requests?,not spam
I appreciate the regular updates on my ongoing support ticket. It helps me stay informed.,not spam
I'm having trouble understanding a specific feature. Is there a tutorial or documentation available?,not spam
Your recent product update is fantastic! The new features add significant value to the platform.,not spam
I encountered a problem with the checkout process. Can you guide me on resolving the issue?,not spam
I'm a long-time customer and wanted to know if there are any exclusive promotions for loyal customers.,not spam
I'm interested in partnering with your company for an event. Whom should I contact for collaboration?,not spam
Your mobile app's user interface is intuitive. How do you gather user feedback for continuous improvement?,not spam
I received a billing statement that seems inaccurate. Can we review the charges together?,not spam
I appreciate the detailed instructions in your online help center. It made troubleshooting much easier.,not spam
I accidentally unsubscribed from your promotional emails. Can I rejoin your mailing list?,not spam
Your team's response time on social media is impressive. How do you manage customer inquiries so efficiently?,not spam
I have a concern about the security of my account. Can you provide information on your security measures?,not spam
I'm curious about upcoming product launches. Is there a newsletter or notification list I can join?,not spam
The response from your technical support team was outstanding. They went above and beyond to assist me.,not spam
I'm experiencing issues with the live chat feature. Is there an alternative method to reach support?,not spam
Your company's blog provides valuable insights. Can you recommend articles on the latest industry trends?,not spam
I received an email about a survey. Participating sounds interesting—how can I share my feedback?,not spam
"The product manual is comprehensive, but I have a specific question. Can you provide clarification?",not spam
I want to update my communication preferences. Where can I manage my email notification settings?,not spam
I'm considering switching my subscription plan. What steps should I take to make this change?,not spam
I have a unique use case for your product. Is there a specialist who can help me explore custom solutions?,not spam
I appreciate the dedication of your support team. How can I leave a positive review for their assistance?,not spam
I'm unable to access certain features on the mobile app. Can you troubleshoot the issue with me?,not spam
"Your recent webinar was informative. Are there upcoming sessions, and how can I register?",not spam
I received an email regarding a scheduled maintenance. Can you confirm the expected downtime?,not spam
I'm curious about the accessibility features in your product. Can you provide more information?,not spam
I encountered an error message during checkout. What steps can I take to complete my purchase?,not spam
I'm interested in becoming a beta tester for upcoming features. How can I sign up for beta testing?,not spam
Your social media presence is engaging. Do you have any upcoming community events or challenges?,not spam
I appreciate the clarity of your terms of service. Are there any upcoming changes I should be aware of?,not spam
I have a question about the refund policy. Can you explain the process and eligibility criteria?,not spam
Your team's response on public forums is professional. How do you handle feedback and criticism?,not spam
I'm impressed with the speed of your website. What measures are in place to ensure optimal performance?,not spam
I received a promotional code but forgot to apply it during checkout. Can you assist in retroactively applying it?,not spam
I'm considering recommending your product to my network. Are there referral programs available?,not spam
I received a product that exceeds my expectations. How can I share my positive experience with others?,not spam
I have a concern about the privacy of my data. Can you provide information on your data protection practices?,not spam
I'm interested in your company's corporate social responsibility initiatives. Where can I learn more?,not spam
I noticed a discrepancy in my account balance. Can you review the recent transactions with me?,not spam
I appreciate the ease of navigation on your website. Are there any upcoming redesigns or updates?,not spam
I'm having trouble accessing certain features on the desktop version. Can you guide me on troubleshooting steps?,not spam
I received an email about a webinar series. Can you share the topics and schedule for the upcoming sessions?,not spam
Your team's responsiveness on social media sets a high standard. How do you manage social customer service?,not spam
I want to express my gratitude for the exceptional service during my recent support interaction.,not spam
I encountered an issue with the mobile app's push notifications. Can you provide guidance on fixing this?,not spam
Your company's commitment to environmental sustainability aligns with my values. How can I support these initiatives?,not spam
I'm interested in your product's integrations. Can you share information on available third-party integrations?,not spam
"I received an email about a customer survey. Is there an incentive for participation, and how can I take part?",not spam
I appreciate the transparency in your communication about service disruptions. It helps build trust with customers.,not spam
I'm curious about your company's vision for the future. Can you share any upcoming milestones?,not spam
I received an email about a new feature release. How can I learn more about its functionality?,not spam
The design of your website is user-friendly. Do you have plans for any visual updates in the near future?,not spam
I'm interested in your product's compatibility with specific operating systems. Can you provide information?,not spam
I received a shipping confirmation email. How can I track the real-time status of my package?,not spam
Your team's response to customer feedback on social media is impressive. How do you prioritize user suggestions?,not spam
I encountered a minor bug in the mobile app. Is there a dedicated channel for reporting software issues?,not spam
I'm considering upgrading my subscription for additional features. What benefits come with the premium plan?,not spam
The documentation for your API is comprehensive. Can you highlight any recent updates or additions?,not spam
I appreciate the detailed instructions provided in your FAQs section. It makes troubleshooting much easier.,not spam
I received a promotional email with a discount code. How can I apply it to my next purchase?,not spam
I have a question about the warranty coverage for a recently purchased product. Can you provide details?,not spam
Your support team's availability during non-business hours is appreciated. Do you offer 24/7 support?,not spam
"I noticed an upcoming event on your calendar. How can I register, and what topics will be covered?",not spam
I'm impressed with the variety of educational resources on your website. Any recommendations for beginners?,not spam
I received an invitation to a customer feedback session. How can I participate and share my insights?,not spam
The account dashboard is well-organized. Can you provide tips for maximizing its efficiency?,not spam
I have a suggestion for a new feature that could enhance the user experience. Where can I submit ideas?,not spam
Your company's commitment to diversity and inclusion is commendable. How do you foster an inclusive environment?,not spam
I encountered an issue with the checkout process. Can you provide assistance in completing my purchase?,not spam
I'm interested in learning about your company's social impact initiatives. Where can I find more information?,not spam
I appreciate the promptness of your team's responses on the live chat feature. Is this available 24/7?,not spam
I'm considering switching to an annual subscription plan. What advantages come with the annual billing cycle?,not spam
Your recent blog post on industry trends was insightful. Can you recommend additional relevant articles?,not spam
I received a post-purchase survey. How can I contribute feedback on my overall shopping experience?,not spam
I encountered a technical issue while using your mobile app. Is there a dedicated technical support line?,not spam
I received an automated call regarding a service update. Can you provide more details on the changes?,not spam
I have a question about the return policy. Can you explain the process and any associated fees?,not spam
Your team's response to my email inquiry was thorough and helpful. How can I express my appreciation?,not spam
I received a product recommendation email. Can you provide more information on the featured products?,not spam
I noticed an improvement in the website's loading speed. How do you address performance optimization?,not spam
I'm interested in joining your referral program. Where can I find details on how to refer friends?,not spam
I received a newsletter with exclusive offers. How can I ensure I receive future newsletters?,not spam
I have a concern about the security of my personal information. Can you provide details on your privacy policy?,not spam
I encountered an issue with the online chat support feature. Can you guide me on resolving this problem?,not spam
I appreciate the informative videos on your YouTube channel. Can you recommend any recent uploads?,not spam
I'm interested in attending a webinar on a specific topic. Can you share the schedule for upcoming webinars?,not spam
I received an email about a customer satisfaction survey. How can I provide feedback on my recent experience?,not spam
I have a question about the product specifications. Is there a resource where I can find detailed information?,not spam
Your team's quick resolution of my technical issue exceeded my expectations. Thank you for the excellent support!,not spam
I noticed a typo in the product description on the website. Is there a way to report content errors for correction?,not spam
I received an email about a flash sale. Can you provide details on the featured products and discounts?,not spam
I'm interested in contributing to your community forums. How can I create an account and start participating?,not spam
I have a suggestion for improving the user interface of your mobile app. Where can I submit design feedback?,not spam
Your team's response on social media reflects genuine engagement. How do you maintain a positive online presence?,not spam
I received a promotional email about a limited-time offer. How can I redeem the special discount?,not spam
I encountered an issue with the order tracking feature on your website. Can you assist in resolving this matter?,not spam
I noticed an improvement in the accuracy of your search functionality. How do you enhance search capabilities?,not spam
I received an email about a customer loyalty program. Can you provide details on the benefits and how to enroll?,not spam
I'm interested in your company's involvement in social responsibility. How do you contribute to charitable causes?,not spam
I'm having difficulty navigating the knowledge base. Can you recommend articles on troubleshooting common issues?,not spam
Your team's response to my inquiry on Twitter was both swift and helpful. How do you manage social media interactions?,not spam
I received an email about a virtual product demonstration. How can I register and participate in the session?,not spam
I noticed an improvement in the response time of your customer support chat. Is this a recent enhancement?,not spam
I'm considering purchasing a gift card. Can you provide details on the available denominations and redemption process?,not spam
I encountered a technical glitch in the mobile app's latest update. How can I report this for resolution?,not spam
Your company's commitment to environmental sustainability aligns with my values. Can you share more about your eco-friendly practices?,not spam
I received an email about a user feedback contest. How can I participate and contribute my suggestions?,not spam
I appreciate the inclusion of diverse voices in your blog content. How do you ensure diverse perspectives are represented?,not spam
I'm interested in learning more about your company's corporate culture. Is there information available on your website?,not spam
I received an email with a customer satisfaction survey. How can I provide feedback on my recent interaction with support?,not spam
I have a question about the terms and conditions of your loyalty program. Can you provide clarification?,not spam
Your recent webinar on industry trends was insightful. Are there upcoming webinars on related topics?,not spam
I encountered an issue with the checkout process on the mobile app. Can you guide me through the steps to complete my purchase?,not spam
I'm interested in exploring your product's integrations. Can you share information on the available third-party integrations?,not spam
I noticed an improvement in the website's loading speed. How do you prioritize and implement performance optimizations?,not spam
I received an email about a beta testing opportunity. How can I sign up to participate in testing new features?,not spam
Your team's response to my support ticket was thorough and addressed my concerns. How can I express my appreciation?,not spam
I encountered a discrepancy in my account balance. Can you review my recent transactions and help resolve the issue?,not spam
I appreciate the inclusive language used in your communications. How do you ensure inclusive messaging in your content?,not spam
I'm interested in learning about your company's social responsibility initiatives. Where can I find detailed information?,not spam
I received an email about a customer feedback webinar. How can I participate and share my thoughts on the user experience?,not spam
Your team's communication on service disruptions is transparent. Can you provide more details on the incident management process?,not spam
I noticed a significant improvement in the accuracy of your automated response system. How do you enhance this functionality?,not spam
I received an email about a product launch. Can you provide details on the new features introduced in the latest release?,not spam
I'm interested in contributing to your community forums. How can I register and start participating in discussions?,not spam
Your recent blog post on industry best practices was informative. Can you recommend additional resources on the topic?,not spam
I encountered a bug in the mobile app. Is there a dedicated channel for reporting technical issues for resolution?,not spam
I appreciate the detailed information provided in your online documentation. Can you highlight any recent updates or additions?,not spam
I received an email about a limited-time promotion. Can you provide details on the products and discounts offered in the promotion?,not spam
I have a question about the refund policy. Can you explain the process and any conditions associated with requesting a refund?,not spam
Your team's response on social media is both professional and engaging. How do you maintain a positive and active online presence?,not spam
I noticed a typo in the product description on your website. Is there a designated channel for reporting content errors?,not spam
I received an email about an upcoming product demo. How can I register for the session and explore the featured functionalities?,not spam
I'm interested in your company's commitment to diversity and inclusion. Can you share more about your inclusive hiring practices?,not spam
Your team's handling of my recent support ticket was exceptional. How do you ensure consistent and high-quality customer service?,not spam
I encountered an issue with the order tracking feature. Can you assist in resolving the issue and providing real-time updates?,not spam
I received a promotional email with a discount code. How can I apply the code to my next purchase for the specified discount?,not spam
I have a suggestion for a new feature that could enhance the user experience. Where can I submit feature requests for consideration?,not spam
Your team's response to my email inquiry demonstrated a deep understanding of the issue. How do you ensure continuous staff training?,not spam
I appreciate the inclusivity in your marketing materials. How do you approach representation to ensure diverse customer perspectives?,not spam
I noticed an improvement in the website's responsiveness. How do you prioritize and implement optimizations for a seamless user experience?,not spam
I received an email about an upcoming webinar series. Can you provide details on the topics covered and the schedule for the sessions?,not spam
I encountered an issue with the live chat feature on your website. Is there an alternative method to reach customer support for assistance?,not spam
Your team's response on social media platforms is both prompt and courteous. How do you manage and prioritize customer inquiries across channels?,not spam
I received an email about a new product feature. Can you provide more information on how to access and utilize the newly introduced functionality?,not spam
I'm interested in exploring your product's compatibility with specific devices. Can you provide information on the supported platforms and devices?,not spam
I noticed a change in the interface of your mobile app. Can you share insights into the decision-making process behind the recent design update?,not spam
I have a question about the terms of service. Can you provide clarification on specific clauses to ensure a clear understanding of the agreement?,not spam
Your team's response to my recent inquiry demonstrated a commitment to excellence in customer service. How do you maintain a customer-centric approach?,not spam
"Hey there! Day's good, just taking it one step at a time.",spam
"Good morning! Plans are ordinary, work and maybe a workout.",spam
"Wassup? Nothing much, just chilling and watching some TV.",spam
"Hi! It's been a while, life's busy but manageable.",spam
"Morning! Everything's fine, just the usual daily routine.",spam
"Hey there! Day's good, just taking it one step at a time.",spam
"Good morning! Plans are ordinary, work and maybe a workout.",spam
